{
  "eventId": "c3e5a7b9-2345-4bcd-8ef0-9b8c7d6e5f4a",
  "eventType": "ShipmentDispatched",
  "schemaVersion": "1.0",
  "correlationId": "6f2b1a3e-2c31-4e9a-9a2d-1a7b6f8e2b10",
  "occurredAt": "2026-07-29T14:02:10.900Z",
  "orderId": "ORD-100301",
  "shipmentId": "SHP-500219",
  "carrier": "FICTIONAL-FREIGHT-CO",
  "trackingNumber": "FFC1234567890",
  "estimatedDeliveryDate": "2026-08-02"
}
